{
  "candidateId": "rimeflow-yolov8n-android-litert-fp32-794e17d9a279",
  "contract": {
    "io": {
      "input": {
        "dtype": "float32",
        "index": 0,
        "layout": "NCHW",
        "name": "serving_default_args_0",
        "quantization": {
          "scale": 0.0,
          "zeroPoint": 0
        },
        "quantizationParameters": {
          "quantizedDimension": 0,
          "scales": [],
          "zeroPoints": []
        },
        "shape": [
          1,
          3,
          640,
          640
        ],
        "shapeSignature": [
          1,
          3,
          640,
          640
        ]
      },
      "output": {
        "dtype": "float32",
        "index": 414,
        "layout": "N_ATTRIBUTES_ANCHORS",
        "name": "serving_default_output_0_output",
        "quantization": {
          "scale": 0.0,
          "zeroPoint": 0
        },
        "quantizationParameters": {
          "quantizedDimension": 0,
          "scales": [],
          "zeroPoints": []
        },
        "shape": [
          1,
          84,
          8400
        ],
        "shapeSignature": [
          1,
          84,
          8400
        ]
      },
      "outputRole": "detections"
    },
    "mapping": {
      "input": "identity: runtime input already uses NCHW FP32 [1,3,640,640]",
      "outputCoordinates": "multiply attributes 0..3 by 640 to reverse the official Ultralytics LiteRT _NormalizeCoords wrapper",
      "outputLayout": "identity: runtime output already uses [batch,attribute,anchor] [1,84,8400]"
    },
    "ownership": {
      "nms": "operator postprocess; no NMS op is present in the model graph",
      "postprocess": "operator decode, confidence threshold and NMS",
      "preprocess": "runtime adapter letterbox/RGB/FP32 [0,1]; not fused into the model"
    }
  },
  "fixtures": [
    {
      "golden": {
        "decodedCanonicalSha256": "4f53cda18c2baa0c0354bb5f9a3ecbe5ed12ab4d8e11ba873c2f11161202b945",
        "decodedCount": 0,
        "hostMappedRawSha256": "2465b2cf37284d92b2f215d06bcf198c032e993622c231f8735e882fd8097477",
        "webRawSha256": "0925949c09194116b3afa6c3ff174ea0df8722103cecd66a4c00f60770ee399c"
      },
      "id": "no-detection",
      "input": {
        "byteOrder": "little-endian",
        "bytes": 4915200,
        "dtype": "float32",
        "path": "inputs/no-detection.f32le",
        "sha256": "06688fff06f12ae3ea0acf7be866cd7d725743484db7d3e91d6a6ab75b49d41b",
        "shape": [
          1,
          3,
          640,
          640
        ]
      },
      "license": {
        "source": "\u7531\u672c\u4ed3\u5e93\u786e\u5b9a\u6027\u811a\u672c\u751f\u6210\uff0c\u4e0d\u542b\u4eba\u7269\u3001\u79c1\u4eba\u5a92\u4f53\u6216\u5916\u90e8\u7d20\u6750",
        "spdx": "CC0-1.0"
      },
      "sourceImageSha256": "5a0d17c1055bd16e1b790fe8fcc048828c4112b50646ad217a25bd4a2fdf833f"
    },
    {
      "golden": {
        "decodedCanonicalSha256": "c3bc650ac7b7c7d5367b4fb7ccdecc4bcc3ac4b96becb1d29c0a68988d982a62",
        "decodedCount": 1,
        "hostMappedRawSha256": "66a39b29b559b39a78160b3bdc201a7bd27a8f2a4d74a8b40ec778b7cf00718d",
        "webRawSha256": "37cc9955c15f1c4283fd2ed0d8aa360905357fd03a386db3a526d94dd0cca212"
      },
      "id": "single-target",
      "input": {
        "byteOrder": "little-endian",
        "bytes": 4915200,
        "dtype": "float32",
        "path": "inputs/single-target.f32le",
        "sha256": "7cde7a22823666ede34cae26a348a563dbd7e64df800406b433733baabee24fe",
        "shape": [
          1,
          3,
          640,
          640
        ]
      },
      "license": {
        "localPath": "evidence/fixtures/licenses/ultralytics-assets-AGPL-3.0.txt",
        "noticePath": "evidence/fixtures/THIRD_PARTY_NOTICES.md",
        "spdx": "AGPL-3.0-only",
        "url": "https://github.com/ultralytics/assets/blob/42ef8a125df038dcca49f6216f446fe9112946c1/LICENSE"
      },
      "sourceImageSha256": "607e88462bd0d80db53b313c12269dff69c608637a582c7a5d2158404b8d4a18"
    },
    {
      "golden": {
        "decodedCanonicalSha256": "c0fdbea7dd064313c2abb88fd31c29f23d14ffe9a80d655f74ca461634949079",
        "decodedCount": 5,
        "hostMappedRawSha256": "7b715a94ce5d732012820c050a77e9c0ab29160e8a526c60f5ff831a110fce34",
        "webRawSha256": "5a9430616fc356b950326b9695aa067a1d5e7bf9b8341ae2ccc974fe35e8f6b0"
      },
      "id": "multi-class",
      "input": {
        "byteOrder": "little-endian",
        "bytes": 4915200,
        "dtype": "float32",
        "path": "inputs/multi-class.f32le",
        "sha256": "628e401f44a59db8370e278b27b946ce7f3d26b4b80f1cdc2cf4e72b945b890c",
        "shape": [
          1,
          3,
          640,
          640
        ]
      },
      "license": {
        "localPath": "evidence/fixtures/licenses/ultralytics-assets-AGPL-3.0.txt",
        "noticePath": "evidence/fixtures/THIRD_PARTY_NOTICES.md",
        "spdx": "AGPL-3.0-only",
        "url": "https://github.com/ultralytics/assets/blob/42ef8a125df038dcca49f6216f446fe9112946c1/LICENSE"
      },
      "sourceImageSha256": "6cdb4b6728a36516826f9adb9387774a6b5db0a49837d515c9045324e04e8688"
    },
    {
      "golden": {
        "decodedCanonicalSha256": "e16e44bb353dae5d8fea62cebefc779ddacce7f6b6c5a2f41f21c97e66d9a7cf",
        "decodedCount": 5,
        "hostMappedRawSha256": "95722a5208d81728c2902a02381cb3690e311be82e09ddb729f5f4b7b9caebd4",
        "webRawSha256": "693f67016b64e244853a3b73db60700ad30df89c4b0e00a215a285d0df6bc4b5"
      },
      "id": "boundary-box",
      "input": {
        "byteOrder": "little-endian",
        "bytes": 4915200,
        "dtype": "float32",
        "path": "inputs/boundary-box.f32le",
        "sha256": "bb14c23a6d37bc4183bc05a908806fbf545587f4f99055a2534c3be93ea6cef0",
        "shape": [
          1,
          3,
          640,
          640
        ]
      },
      "license": {
        "localPath": "evidence/fixtures/licenses/ultralytics-assets-AGPL-3.0.txt",
        "noticePath": "evidence/fixtures/THIRD_PARTY_NOTICES.md",
        "spdx": "AGPL-3.0-only",
        "url": "https://github.com/ultralytics/assets/blob/42ef8a125df038dcca49f6216f446fe9112946c1/LICENSE"
      },
      "sourceImageSha256": "75c9991d89e8c036c6ee135ada52d21b7c6f2007c8af41534f8801b105eac057"
    },
    {
      "golden": {
        "decodedCanonicalSha256": "5d7938d8f76d3b800ffa62bb1b1fa6f97b9986ae9b1fbff16487cd6d4cc14cd7",
        "decodedCount": 1,
        "hostMappedRawSha256": "a04bae281dd7d6bfcd0dda8bc0f1e25346a4dbe9a64b74cd6e1ac9419b133e90",
        "webRawSha256": "355d3d29fcfbe31fd93480a5697a5b34cd5d153a116629ab77304c508301e686"
      },
      "id": "extreme-aspect",
      "input": {
        "byteOrder": "little-endian",
        "bytes": 4915200,
        "dtype": "float32",
        "path": "inputs/extreme-aspect.f32le",
        "sha256": "ebb46465c0525b41a1151d4f14712669319f02db1c7368c50933b8ff5ecfcdcf",
        "shape": [
          1,
          3,
          640,
          640
        ]
      },
      "license": {
        "localPath": "evidence/fixtures/licenses/ultralytics-assets-AGPL-3.0.txt",
        "noticePath": "evidence/fixtures/THIRD_PARTY_NOTICES.md",
        "spdx": "AGPL-3.0-only",
        "url": "https://github.com/ultralytics/assets/blob/42ef8a125df038dcca49f6216f446fe9112946c1/LICENSE"
      },
      "sourceImageSha256": "511885000defcce877a128d19407a07b3601749268ec1dac9332916e560e81fc"
    }
  ],
  "hostProof": {
    "comparison": {
      "artifactSha256Equal": true,
      "fixtureRawAndDecodedEqual": true,
      "goldenReportDigestEqual": true,
      "ioMetadataEqual": true,
      "manifestDigestEqual": true,
      "trackedWorktreeUnchanged": true
    },
    "goldenReport": {
      "path": "evidence/reports/litert-golden-report.json",
      "sha256": "071f418b79c0612e00bcea97aa7785cc4e90e4aeb2356884703e666c4bfb9e28",
      "summary": {
        "allFinite": true,
        "allShapesMatched": true,
        "classMismatchCount": 0,
        "deterministic": true,
        "fixtureCount": 5,
        "maximumConfidenceAbsolute": 9.530395508328127e-07,
        "maximumDecodedBboxAbsolute": 6.82200851476189e-07,
        "maximumRawAbsolute": 0.003204345703125,
        "maximumRawRelative": 4.391961097717285,
        "minimumBboxIou": 0.9999981541566957,
        "rawToleranceMismatchCount": 0
      }
    },
    "replayArtifactManifestSha256": [
      "f1f95bac2006cd02e364123ab9e7556cc331e6d20f49006c50fcebd15d0c4881",
      "f1f95bac2006cd02e364123ab9e7556cc331e6d20f49006c50fcebd15d0c4881"
    ],
    "replayArtifactSha256": [
      "794e17d9a2795084787e5125bcfada6cb501c6afc4f708e7e58e96fd8dc84be1",
      "794e17d9a2795084787e5125bcfada6cb501c6afc4f708e7e58e96fd8dc84be1"
    ],
    "rounds": 2
  },
  "licenses": {
    "checkpoint": {
      "declared": "AGPL-3.0 License (https://ultralytics.com/license)",
      "redistributionAllowed": false
    },
    "converterAndRuntime": {
      "declared": "Apache-2.0",
      "packages": [
        "ai-edge-litert",
        "litert-converter",
        "litert-torch"
      ]
    },
    "fixtures": {
      "manifestPath": "evidence/fixtures/manifest.json",
      "manifestSha256": "430c391b9cab0c36b2bde93964e8f6afcd66b0dcb05b055d2728c47679a38acc",
      "policy": "per-file; test-and-evidence-only"
    },
    "repository": {
      "path": "LICENSE",
      "sha256": "0e9cf1beb7efd7c779613bd0030ed303a5c26d73dd5e22e5a8fad4ffc2e968e0",
      "spdx": "MIT"
    }
  },
  "model": {
    "artifact": {
      "bytes": 12841227,
      "format": "TFLite FlatBuffer with deterministic Ultralytics metadata ZIP trailer",
      "path": "model/yolov8n-fp32.tflite",
      "sha256": "794e17d9a2795084787e5125bcfada6cb501c6afc4f708e7e58e96fd8dc84be1"
    },
    "canonicalOnnx": {
      "firstRepositoryCommit": "8eb3a3f33ca945694af5a08b81b28a013af8695a",
      "path": "models/yolov8n.onnx",
      "sha256": "9e7e3921595672c4b97e78f78bf5604d86ffc117773da49f142d1047109d07ad"
    },
    "id": "rimeflow-yolov8n",